{
  "accuracy": 0.96,
  "benchmark": "perseus-vault-memory-quality",
  "benchmark_id": "perseus-vault-memory-quality",
  "binary": "perseus-vault",
  "binary_sha256": "db468d4b5750b02ea110f926fe78e21d9a065b874c76bd970e4a3698fb50f3b5",
  "capabilities": {
    "action_control_plane": {
      "missing_tools": [],
      "required_tools": [
        "perseus_vault_agent",
        "perseus_vault_authority_set",
        "perseus_vault_action_intent",
        "perseus_vault_action_complete",
        "perseus_vault_action_receipt_get",
        "perseus_vault_action_lease_acquire",
        "perseus_vault_action_lease_release"
      ],
      "status": "available"
    },
    "compact": {
      "missing_tools": [],
      "required_tools": [
        "perseus_vault_compact"
      ],
      "status": "available"
    },
    "context": {
      "missing_tools": [],
      "required_tools": [
        "perseus_vault_context"
      ],
      "status": "available"
    },
    "mcp_stdio": {
      "count": 119,
      "status": "available"
    },
    "stage_trace_validate": {
      "missing_tools": [],
      "required_tools": [
        "perseus_vault_stage_trace_validate"
      ],
      "status": "available"
    }
  },
  "cases": [
    {
      "category": "shared_memory",
      "checks": {
        "eligible_memory_served": true,
        "ineligible_memory_hidden": true
      },
      "evidence": {
        "author_key_present": true,
        "other_key_present": false
      },
      "id": "shared-memory-scope-basic",
      "status": "passed"
    },
    {
      "category": "adversarial",
      "checks": {
        "contamination_does_not_win": true,
        "verified_truth_wins": true
      },
      "evidence": {
        "contamination_key_present": true,
        "truth_key_present": true
      },
      "id": "adversarial-contamination-basic",
      "status": "passed"
    },
    {
      "category": "validity",
      "checks": {
        "valid_interval_hit": true,
        "validity_provenance_present": true
      },
      "evidence": {
        "inside_found": true,
        "outside_found": false,
        "provenance_field_count": 3
      },
      "id": "validity-valid-at-current",
      "status": "passed"
    },
    {
      "category": "validity",
      "checks": {
        "valid_interval_gap_empty": true
      },
      "evidence": {
        "inside_found": true,
        "outside_found": false,
        "provenance_field_count": 3
      },
      "id": "validity-valid-at-gap",
      "status": "passed"
    },
    {
      "category": "scope_validity",
      "checks": {
        "other_workspace_hidden": true
      },
      "evidence": {
        "other_workspace_key_present": false,
        "personal_profile_key_present": true,
        "scoped_key_count": 1,
        "shared_profile_personal_key_present": false
      },
      "id": "scope-invalid-recall-external",
      "status": "passed"
    },
    {
      "category": "scope_validity",
      "checks": {
        "requested_workspace_served": true
      },
      "evidence": {
        "other_workspace_key_present": false,
        "personal_profile_key_present": true,
        "scoped_key_count": 1,
        "shared_profile_personal_key_present": false
      },
      "id": "scope-invalid-recall-workspace",
      "status": "passed"
    },
    {
      "category": "provenance",
      "checks": {
        "core_provenance_complete": true
      },
      "evidence": {
        "core_field_count": 11,
        "core_field_total": 11,
        "evidence_hash": "2b6b868454f52e040b2e4f1ea01cbe0a48c2796fa8ae16920579313fc02e9e57",
        "evidence_mode": "480fcdae08b13a66f688aba3822cfd3271bda2591382b8b5b4dd63ebfdb1f0e6",
        "external_ref_count": 1,
        "origin_present": true
      },
      "id": "provenance-core-fields",
      "status": "passed"
    },
    {
      "category": "provenance",
      "checks": {
        "origin_and_reference_complete": true
      },
      "evidence": {
        "core_field_count": 11,
        "core_field_total": 11,
        "evidence_hash": "2b6b868454f52e040b2e4f1ea01cbe0a48c2796fa8ae16920579313fc02e9e57",
        "evidence_mode": "480fcdae08b13a66f688aba3822cfd3271bda2591382b8b5b4dd63ebfdb1f0e6",
        "external_ref_count": 1,
        "origin_present": true
      },
      "id": "provenance-origin-refs",
      "status": "passed"
    },
    {
      "category": "provenance",
      "checks": {
        "evidence_hash_complete": true
      },
      "evidence": {
        "core_field_count": 11,
        "core_field_total": 11,
        "evidence_hash": "2b6b868454f52e040b2e4f1ea01cbe0a48c2796fa8ae16920579313fc02e9e57",
        "evidence_mode": "480fcdae08b13a66f688aba3822cfd3271bda2591382b8b5b4dd63ebfdb1f0e6",
        "external_ref_count": 1,
        "origin_present": true
      },
      "id": "provenance-evidence-hash",
      "status": "passed"
    },
    {
      "category": "replay",
      "checks": {
        "frozen_recall_replays": true
      },
      "evidence": {
        "frozen_digest": "76eedb952a5212b76830cdff4826781266e6df9e7a78c8ebf9ed55c952c2a224",
        "frozen_key_count": 9,
        "stage_trace_checked": true,
        "temporal_digest": "e3b0c44298fc1c149afbf4c8996fb92427ae41e4649b934ca495991b7852b855"
      },
      "id": "replay-frozen-recall",
      "status": "passed"
    },
    {
      "category": "replay",
      "checks": {
        "temporal_recall_replays": true
      },
      "evidence": {
        "frozen_digest": "76eedb952a5212b76830cdff4826781266e6df9e7a78c8ebf9ed55c952c2a224",
        "frozen_key_count": 9,
        "stage_trace_checked": true,
        "temporal_digest": "e3b0c44298fc1c149afbf4c8996fb92427ae41e4649b934ca495991b7852b855"
      },
      "id": "replay-temporal-recall",
      "status": "passed"
    },
    {
      "category": "replay",
      "checks": {
        "stage_trace_replay_matches": true
      },
      "evidence": {
        "frozen_digest": "76eedb952a5212b76830cdff4826781266e6df9e7a78c8ebf9ed55c952c2a224",
        "frozen_key_count": 9,
        "stage_trace_checked": true,
        "temporal_digest": "e3b0c44298fc1c149afbf4c8996fb92427ae41e4649b934ca495991b7852b855"
      },
      "id": "replay-stage-fingerprint",
      "status": "passed"
    },
    {
      "category": "mutation",
      "checks": {
        "single_current_key": true
      },
      "evidence": {
        "current_row_count": 1,
        "history_total": 1,
        "live_key_present": true,
        "prior_version_content_present": true
      },
      "id": "mutation-idempotent-update",
      "status": "passed"
    },
    {
      "category": "mutation",
      "checks": {
        "prior_version_retained": true
      },
      "evidence": {
        "current_row_count": 1,
        "history_total": 1,
        "live_key_present": true,
        "prior_version_content_present": true
      },
      "id": "mutation-history-retained",
      "status": "passed"
    },
    {
      "category": "mutation",
      "checks": {
        "superseded_version_not_recalled": true
      },
      "evidence": {
        "current_row_count": 1,
        "history_total": 1,
        "live_key_present": true,
        "prior_version_content_present": true
      },
      "id": "mutation-live-recall",
      "status": "passed"
    },
    {
      "category": "compaction_projection",
      "checks": {
        "low_decay_compacted": true
      },
      "evidence": {
        "entities_archived": 1,
        "entities_examined": 14
      },
      "id": "compaction-archive",
      "status": "passed"
    },
    {
      "category": "compaction_projection",
      "checks": {
        "projection_budget_bounded": true
      },
      "evidence": {
        "always_inject_budget": 240,
        "always_inject_entities": 1,
        "always_inject_injected_chars": 240,
        "always_inject_total_chars": 244,
        "on_demand_budget": 240,
        "on_demand_entities": 1,
        "on_demand_injected_chars": 240,
        "on_demand_total_chars": 244,
        "other_workspace_visible": false
      },
      "id": "projection-context-budget",
      "status": "passed"
    },
    {
      "category": "compaction_projection",
      "checks": {
        "projection_scope_respected": true
      },
      "evidence": {
        "always_inject_budget": 240,
        "always_inject_entities": 1,
        "always_inject_injected_chars": 240,
        "always_inject_total_chars": 244,
        "on_demand_budget": 240,
        "on_demand_entities": 1,
        "on_demand_injected_chars": 240,
        "on_demand_total_chars": 244,
        "other_workspace_visible": false
      },
      "id": "projection-scope",
      "status": "passed"
    },
    {
      "category": "action_grounding",
      "checks": {
        "authority_scope_matches": true
      },
      "evidence": {
        "authority_version": 1,
        "intent_hash": "7ba26df34a18456752a3452986abd8865ff0d84f7e4718aa20ccbae363c50ba4",
        "lease_released": true,
        "outcome_hash": "b136db6f2e98b27448bcd1460aa1965fb8d358245f2e8476f41a023e6cb9def2",
        "receipt_present": true
      },
      "id": "action-authority",
      "status": "passed"
    },
    {
      "category": "action_grounding",
      "checks": {
        "receipt_hashes_complete": true
      },
      "evidence": {
        "authority_version": 1,
        "intent_hash": "7ba26df34a18456752a3452986abd8865ff0d84f7e4718aa20ccbae363c50ba4",
        "lease_released": true,
        "outcome_hash": "b136db6f2e98b27448bcd1460aa1965fb8d358245f2e8476f41a023e6cb9def2",
        "receipt_present": true
      },
      "id": "action-receipt",
      "status": "passed"
    },
    {
      "category": "action_grounding",
      "checks": {
        "action_reference_grounded": true
      },
      "evidence": {
        "authority_version": 1,
        "intent_hash": "7ba26df34a18456752a3452986abd8865ff0d84f7e4718aa20ccbae363c50ba4",
        "lease_released": true,